<?xml version="1.0" encoding="UTF-8"?>
<!DOCTYPE dataset SYSTEM "test/dtd/tweagle.dtd">
<dataset>
    <donor_users du_name="Frank" male="true"/>

    <donor_users du_name="Tony" male="true"
                 take_messages_date="2015-07-11"
                 take_following_date="2015-06-12"
                 take_followers_date="2015-03-14"/>

    <donor_users du_name="Ann" male="false"/>

    <donor_users du_name="Betty" male="false"
                 take_messages_date="2014-10-15"
                 take_following_date="2014-11-22"
                 take_followers_date="2014-12-12"/>

    <messages id="1" message="jascj" owner_id="Betty" posted_date="2014-10-15 10:50:30" synonymized="true" posted="false"/>
    <messages id="2" message="cassa" owner_id="Tony" posted_date="2013-10-23 07:36:51" synonymized="true" posted="false"/>
    <messages id="3" message=";[lk[" owner_id="Tony" posted_date="2013-10-23 11:49:30" synonymized="true" posted="false"/>
    <messages id="4" message="casge" owner_id="Frank" posted_date="2014-08-14 12:10:05" synonymized="true" posted="false"/>
</dataset>